{
  "$schema": "http://json-schema.org/draft-07/schema#",
  "$id": "scaffold-variant.schema.json",
  "title": "ScaffoldVariant",
  "description": "Visual expression within a scaffold — same routing/files, different aesthetic (typography, theme tokens, motif, prompt hints). Source of truth: src/lib/gen/scaffold-variants/types.ts",
  "type": "object",
  "required": [
    "id",
    "scaffoldId",
    "label",
    "signatureMotif",
    "colorMode",
    "keywords",
    "fontPairings",
    "promptHints"
  ],
  "additionalProperties": false,
  "properties": {
    "$schema": {
      "type": "string",
      "description": "Optional JSON Schema reference for editor validation. Recommended on every variant file: `\"$schema\": \"../../../docs/schemas/strict/scaffold-variant.schema.json\"`."
    },
    "id": {
      "type": "string",
      "pattern": "^[a-z0-9]+(-[a-z0-9]+)*$",
      "description": "Kebab-case unique identifier. Must match the filename (without .json)."
    },
    "scaffoldId": {
      "type": "string",
      "enum": [
        "base-nextjs",
        "landing-page",
        "saas-landing",
        "portfolio",
        "blog",
        "dashboard",
        "auth-pages",
        "ecommerce",
        "app-shell"
      ],
      "description": "Which scaffold this variant belongs to. Must match the parent directory name."
    },
    "label": {
      "type": "string",
      "minLength": 2,
      "maxLength": 60,
      "description": "Human-readable display name (e.g. 'Corporate Grid', 'Warm Local')."
    },
    "description": {
      "type": "string",
      "maxLength": 500,
      "description": "2-3 sentences: WHO is this for, WHAT makes it visually distinct."
    },
    "keywords": {
      "type": "array",
      "items": { "type": "string", "minLength": 1 },
      "minItems": 3,
      "maxItems": 20,
      "description": "Match terms from user prompts and briefs. Mix Swedish and English. More specific = better matching."
    },
    "fontPairings": {
      "type": "array",
      "items": {
        "type": "object",
        "required": ["heading", "body"],
        "additionalProperties": false,
        "properties": {
          "heading": { "type": "string", "description": "Google Font name for headings." },
          "body": { "type": "string", "description": "Google Font name for body text." }
        }
      },
      "minItems": 1,
      "maxItems": 3,
      "description": "Font pairings injected into the system prompt. First pairing is primary."
    },
    "signatureMotif": {
      "type": "string",
      "minLength": 10,
      "maxLength": 120,
      "description": "One phrase capturing the visual DNA (e.g. 'precise grid alignment, neutral surfaces, and partner-proof rhythm')."
    },
    "colorMode": {
      "type": "string",
      "enum": ["light", "dark", "either"],
      "description": "'light' or 'dark' for strong preference, 'either' for neutral variants."
    },
    "promptHints": {
      "type": "array",
      "items": { "type": "string", "minLength": 10 },
      "minItems": 1,
      "maxItems": 5,
      "description": "Short cues injected as '- Variant cues:' bullets in the '## Scaffold Variant (this generation)' block of the system prompt. Be SPECIFIC to this variant, not generic. The first 3 entries are rendered."
    },
    "signaturePatterns": {
      "type": "object",
      "description": "Concrete layouts/motifs/antiPatterns that give the LLM specific visual direction. Replaces the generic guidance fields removed 2026-04-17. Populated by scripts/scaffolds/auto-curate-variant-patterns.ts. Each entry must be SPECIFIC ('asymmetric hero with floating product card') not abstract ('modern layout').",
      "required": ["layouts", "motifs", "antiPatterns"],
      "additionalProperties": false,
      "properties": {
        "layouts": {
          "type": "array",
          "items": { "type": "string", "minLength": 12 },
          "minItems": 3,
          "maxItems": 5,
          "description": "3-5 concrete layout choices the variant prefers."
        },
        "motifs": {
          "type": "array",
          "items": { "type": "string", "minLength": 10 },
          "minItems": 2,
          "maxItems": 4,
          "description": "2-4 visual motifs that read at first glance."
        },
        "antiPatterns": {
          "type": "array",
          "items": { "type": "string", "minLength": 10 },
          "minItems": 2,
          "maxItems": 4,
          "description": "2-4 patterns the LLM should NOT use for this variant."
        }
      }
    },
    "themeTokens": {
      "type": "object",
      "description": "CSS custom property values injected into the @theme block. Use oklch() for colors.",
      "additionalProperties": false,
      "properties": {
        "background": { "type": "string" },
        "foreground": { "type": "string" },
        "card": { "type": "string" },
        "cardForeground": { "type": "string" },
        "primary": { "type": "string" },
        "primaryForeground": { "type": "string" },
        "secondary": { "type": "string" },
        "secondaryForeground": { "type": "string" },
        "muted": { "type": "string" },
        "mutedForeground": { "type": "string" },
        "accent": { "type": "string" },
        "accentForeground": { "type": "string" },
        "border": { "type": "string" },
        "ring": { "type": "string" },
        "radius": { "type": "string", "description": "Border radius (e.g. '0.75rem', '1.1rem')." },
        "bodyBackgroundImage": { "type": "string", "description": "CSS background-image for body (gradients, patterns)." }
      }
    },
    "sourceTemplateIds": {
      "type": "array",
      "items": { "type": "string" },
      "maxItems": 6,
      "description": "Ordered inspiration candidates: v0-mall Blob ids resolved against template-blob-manifest.json (written by the backoffice Scaffold Wizard / Lifecycle). Every id MUST exist in the Blob manifest. On init, runtime selects at most one candidate whose category denotes a complete site/app, sends its still image as style-only vision input, and may inject bounded frontend excerpts from the same Blob ZIP. Component/animation/layout/design-system and ambiguous AI categories are excluded."
    },
    "default": {
      "type": "boolean",
      "description": "Marks the canonical fallback variant for this scaffold (used by the backoffice and as the safety pick when no other ranking signal applies). NOTE: as of 2026-04 the matcher no longer adds a numeric scoring bonus for `default: true` (see src/lib/gen/scaffold-variants/matcher.ts) — keyword and embedding matches decide. Convention: keep exactly one default per scaffold; sibling variants stay `default: false` and earn their priority via keywords + embeddings."
    }
  }
}
