{
  "id": "editorial-serif",
  "scaffoldId": "blog",
  "label": "Editorial Serif",
  "description": "Reading-led blog variant with stronger typography and editorial hierarchy.",
  "keywords": [
    "editorial",
    "essay",
    "reading",
    "magazine",
    "content",
    "blog",
    "serif",
    "longform"
  ],
  "fontPairings": [
    {
      "heading": "Playfair Display",
      "body": "Source Sans 3"
    }
  ],
  "signatureMotif": "editorial type hierarchy, generous reading rhythm, and calm framing",
  "colorMode": "light",
  "promptHints": [
    "Make reading comfort and article hierarchy more important than card-heavy grids.",
    "Use typography and spacing to create authority before adding decorative layout moves."
  ],
  "themeTokens": {
    "background": "oklch(0.985 0.004 85)",
    "foreground": "oklch(0.2 0.015 45)",
    "card": "oklch(0.995 0.003 85)",
    "primary": "oklch(0.48 0.1 35)",
    "primaryForeground": "oklch(0.98 0 0)",
    "secondary": "oklch(0.96 0.005 75)",
    "muted": "oklch(0.95 0.004 65)",
    "accent": "oklch(0.9 0.02 60)",
    "border": "oklch(0.88 0.004 65)",
    "ring": "oklch(0.48 0.1 35)",
    "radius": "0.85rem"
  },
  "sourceTemplateIds": [
    "blog-a-next-js-14-blog-with-server-components",
    "blog-blog-with-agility-cms-and-next-js",
    "blog-clean-next-js-sanity-app",
    "blog-launchpad-next-js-strapi-starter"
  ],
  "default": true
}
