{
  "id": "megastore-clean",
  "scaffoldId": "ecommerce",
  "label": "Megastore Clean",
  "description": "Catalog-heavy ecommerce variant with cleaner navigation and retail clarity.",
  "keywords": [
    "catalog",
    "storefront",
    "ecommerce",
    "retail",
    "megastore",
    "clean",
    "marketplace",
    "katalog"
  ],
  "fontPairings": [
    {
      "heading": "Inter",
      "body": "Inter"
    }
  ],
  "signatureMotif": "clean retail IA, strong faceting rhythm, and conversion-first clarity",
  "colorMode": "light",
  "promptHints": [
    "Optimize for product discovery, filtering, and cart clarity before decorative storytelling.",
    "Use a retailer mindset: navigation, categories, and trust must read instantly."
  ],
  "themeTokens": {
    "background": "oklch(0.99 0.002 255)",
    "foreground": "oklch(0.22 0.01 255)",
    "card": "oklch(1 0 0)",
    "primary": "oklch(0.57 0.13 250)",
    "primaryForeground": "oklch(0.98 0 0)",
    "secondary": "oklch(0.97 0.004 255)",
    "muted": "oklch(0.95 0.004 255)",
    "accent": "oklch(0.93 0.01 240)",
    "border": "oklch(0.9 0.004 255)",
    "ring": "oklch(0.57 0.13 250)",
    "radius": "0.9rem"
  },
  "sourceTemplateIds": [
    "ecommerce-blazity-enterprise-ecommerce-starter",
    "ecommerce-stripe-subscription-starter",
    "ecommerce-your-next-store-commerce-with-next-js-and-stripe",
    "starter-next-js-app-router-playground"
  ],
  "default": true
}
